Microsoft Windows [Version 6.1.7601]
Copyright (c) 2009 Microsoft Corporation.  All rights reserved.

C:\Users\user>C:\app\Admin\product\11.2.0\dbhome_1\BIN\sqlplus.exe

SQL*Plus: Release 11.2.0.1.0 Production on Mon Jul 22 13:49:43 2019

Copyright (c) 1982, 2010, Oracle.  All rights reserved.

Enter user-name: RA1711003010009@csedb
Enter password:

Connected to:
Oracle Database 11g Enterprise Edition Release 11.2.0.1.0 - Production
With the Partitioning, OLAP, Data Mining and Real Application Testing options

SQL> create table department(sno int, sname varchar2(10),m1 int,m2 int);

Table created.

SQL> insert into department values(1,'Ishan',90,85);

1 row created.

SQL> insert into department values (2,'Anubhav',95,86);

1 row created.

SQL> insert into department values(3,'Srinath',90,80);

1 row created.

SQL> insert into department values(4,'ritesh',100,100);

1 row created.

SQL> select * from department;

       SNO SNAME              M1         M2
---------- ---------- ---------- ----------
         1 Ishan              90         85
         2 Anubhav            95         86
         3 Srinath            90         80
         4 ritesh            100        100

SQL> delete from department where m1=100;

1 row deleted.

SQL> select * from department;

       SNO SNAME              M1         M2
---------- ---------- ---------- ----------
         1 Ishan              90         85
         2 Anubhav            95         86
         3 Srinath            90         80

SQL> desc department;
 Name                                      Null?    Type
 ----------------------------------------- -------- ----------------------------

 SNO                                                NUMBER(38)
 SNAME                                              VARCHAR2(10)
 M1                                                 NUMBER(38)
 M2                                                 NUMBER(38)

SQL> update department set sno=4 where m1=75;

0 rows updated.

SQL> select * from department;

       SNO SNAME              M1         M2
---------- ---------- ---------- ----------
         1 Ishan              90         85
         2 Anubhav            95         86
         3 Srinath            90         80

SQL> alter table department add (total int);

Table altered.

SQL> truncate table department;

Table truncated.

SQL> drop table department;

Table dropped.

SQL> cls
SP2-0042: unknown command "cls" - rest of line ignored.
SQL> clear\
SP2-0158: unknown CLEAR option "\"
SQL> clear\
SP2-0158: unknown CLEAR option "\"
SQL> clear
SQL>
SQL>
SQL>
SQL> columns cleared
breaks cleared
computes cleared
Disconnected from Oracle Database 11g Enterprise Edition Release 11.2.0.1.0 - Pr
oduction
With the Partitioning, OLAP, Data Mining and Real Application Testing options

C:\Users\user>

C:\Users\user>

C:\Users\user>

C:\Users\user>

C:\Users\user>

C:\Users\user>

C:\Users\user>

C:\Users\user>clear


C:\Users\user>C:\app\Admin\product\11.2.0\dbhome_1\BIN\sqlplus.exe

SQL*Plus: Release 11.2.0.1.0 Production on Mon Jul 22 14:12:13 2019

Copyright (c) 1982, 2010, Oracle.  All rights reserved.

Enter user-name: RA17110030100009@csedb
Enter password:
ERROR:
ORA-01017: invalid username/password; logon denied


Enter user-name:
C:\Users\user>clear


C:\Users\user>C:\app\Admin\product\11.2.0\dbhome_1\BIN\sqlplus.exe

SQL*Plus: Release 11.2.0.1.0 Production on Mon Jul 22 14:12:31 2019

Copyright (c) 1982, 2010, Oracle.  All rights reserved.

Enter user-name: RA1711003010009@csedb
Enter password:

Connected to:
Oracle Database 11g Enterprise Edition Release 11.2.0.1.0 - Production
With the Partitioning, OLAP, Data Mining and Real Application Testing options

SQL> create table ex2(sno int,sname varchar(20),m1 int,m2 int,total int);

Table created.

SQL> insert into ex2 values(1,'Raahul',80,90,170);

1 row created.

SQL> insert into ex2 values(2,'Suresh',90,90,180);

1 row created.

SQL> insert into ex2 values(3,'Ramesh',70,80,150);

1 row created.

SQL> select sno,sname,m1*2,m2*3,total/2 from ex2;

       SNO SNAME                      M1*2       M2*3    TOTAL/2
---------- -------------------- ---------- ---------- ----------
         1 Raahul                      160        270         85
         2 Suresh                      180        270         90
         3 Ramesh                      140        240         75

SQL> select * from ex2 where m1>75 or m2>75;

       SNO SNAME                        M1         M2      TOTAL
---------- -------------------- ---------- ---------- ----------
         1 Raahul                       80         90        170
         2 Suresh                       90         90        180
         3 Ramesh                       70         80        150

SQL> select * from ex2 where m1>75 and m2<75;

no rows selected

SQL> select * from ex2 where m1 between 69 and 81;

       SNO SNAME                        M1         M2      TOTAL
---------- -------------------- ---------- ---------- ----------
         1 Raahul                       80         90        170
         3 Ramesh                       70         80        150

SQL> select * from ex2 where m2 not between 70 and 85;

       SNO SNAME                        M1         M2      TOTAL
---------- -------------------- ---------- ---------- ----------
         1 Raahul                       80         90        170
         2 Suresh                       90         90        180

SQL>
